{"backend":{"availability":"available","deployed_at":"2026-07-20T09:55:00Z","deployment_id":"deploy-synthetic-042","environment":"synthetic-qa","image_digest":"sha256:2222222222222222222222222222222222222222222222222222222222222222","sources":[{"dirty":false,"repository_id":"repo-sample-backend","revision":"89abcdef0123456789abcdef0123456789abcdef"}],"unavailable_reason":null},"build_id":"build-ios-synthetic-031","build_identity_digest":"sha256:f64af91f8587624ef1f7be29e7651a44b82e86f922ee4bc15c3105f9d467550b","contract_version":"tacua.build-identity@1.0.0","media_type":"application/vnd.tacua.build-identity+json;version=1.0.0","mobile":{"app_version":"1.7.0","application_id":"com.example.samplemobileapp.tacua.synthetic","build_number":"31","distribution":"testflight","native_binary_digest":"sha256:1111111111111111111111111111111111111111111111111111111111111111","platform":"ios","source":{"dirty":false,"repository_id":"repo-sample-mobile-app","revision":"0123456789abcdef0123456789abcdef01234567"}},"organization_id":"org-synthetic","project_id":"project-sample-mobile-app-synthetic","sdk":{"capture_schema_version":"tacua.sdk-evidence@1.0.0","configuration_digest":"sha256:3333333333333333333333333333333333333333333333333333333333333333","package_name":"@tacua/mobile-sdk","package_version":"0.1.0","source_revision":"fedcba9876543210fedcba9876543210fedcba98"}}
